{"baseIndex":"6952.07333333333333333333333333333333333333333333333333333333","basePriceReference":"preços médios de 2024","brazilPipCpi2024Base2021":"1.192919586578344","brazilPipPpp2021":"2.44986319541931","brlPerIntl2024Derived":"2.92248979025310406149724542264","combinedFactorState":"DERIVED","currentIndex":"7657.7300000000000","dataset":"world-price-alignment","decisionIds":["D069","D070"],"formula":"dailyPPP = (householdIncomeCurrent / residents) * (baseIndex / currentIndex) / (brazilPipPpp2021 * brazilPipCpi2024Base2021) * 12 / 365","generatedAt":"2026-08-19","generatedBy":"scripts/data/world/production_package.py","integration":{"worldFrontendIntegrationAllowed":false},"pipVersion":"20260324_2021","pppBase":2021,"precision":{"intermediateRounding":"none","storage":"decimal_strings"},"priceIndexReferenceMonth":"2026-07","productionBuild":"20260324_2021_01_02_PROD","rawSources":[{"accessedAtUtc":"2026-08-19T13:37:16.1377011Z","kind":"PIP_PPP","path":"data/raw/world/pip/20260324_2021/pip-20260324_2021_01_02_PROD-ppp.raw.csv","sha256":"792476948DA84A005CC9C61C359CB586B42866F850F55973EF7BDC2693347EB6","sizeBytes":7500},{"accessedAtUtc":"2026-08-19T13:39:33.4079192Z","kind":"PIP_CPI","path":"data/raw/world/pip/20260324_2021/pip-20260324_2021_01_02_PROD-cpi.raw.csv","sha256":"E2F558A28FBBD91F69EDB5FEF4BC10DED19F17D315090CB70031F2C993408ABE","sizeBytes":204060},{"accessedAtUtc":"2026-08-19T16:16:34.9458388Z","kind":"IBGE_IPCA","path":"data/raw/world/ipca/sidra-1737-v2266/ipca-sidra-1737-v2266-202401-202607.raw.json","sha256":"3106FED4AAA57DE4E8154FB6A79AB8FBB0FAA71A2DA72353D652D1405A0066F8","sizeBytes":7028}],"referenceYear":2024,"schema":"config/schemas/world-price-alignment.schema.json","schemaSha256":"8D765123A6B85923129168B966DEA9F945EB810CCBEA34C60378BFA902528AD7","schemaVersion":"1.0.0","sidraTable":1737,"sidraVariable":2266,"source":"IBGE SIDRA","status":"CANONICAL_PRODUCTION_FRONTEND_BLOCKED","temporalUpdateRule":"mês posterior exige evidência oficial preservada, atualização explícita, regeneração de golden cases, testes e promoção autorizada","version":"2024-2026-07-pip-20260324_2021-v1"}
